<?xml version="1.0" encoding="UTF-8"?>
<SHOP xmlns:xsi="http://www.w3.org/2001/XMLSchema-instance" xsi:noNamespaceSchemaLocation="modely.xsd">
    <SHOPITEM>
        <Model>
            <Název>H0 - elektrická lokomotiva Vectron Metrans</Název>
            <Druh>Elektrická Lokomotiva</Druh>
            <Měřítko>H0</Měřítko>
            <Žel.správa>METRANS</Žel.správa>
            <Epocha>VI</Epocha>
            <Edice>PIKO EXPERT</Edice>
            <Přezdívka>Vectron</Přezdívka>
            <DCC_konektor>Ano NEM 658 Plux22</DCC_konektor>
            <Délka>218mm</Délka>
            <Poloměr>358mm</Poloměr>
            <Osvětlení>bílá / červená</Osvětlení>
            <Stát>Česko</Stát>
            <Výrobce>PIKO</Výrobce>
            <Čís.produktu>21605</Čís.produktu>
            <Cena>4990Kč</Cena>
            <Skladem>
                <SklademJe>Ano</SklademJe>
                <SklademKs>3Ks</SklademKs>
            </Skladem>
        </Model>
    </SHOPITEM>

    <SHOPITEM>
        <Model>
            <Název>H0 - elektrická lokomotiva Vectron Regiojet CZ</Název>
            <Druh>Elektrická Lokomotiva</Druh>
            <Měřítko>H0</Měřítko>
            <Žel.správa>RegioJet CZ/SK</Žel.správa>
            <Epocha>VI</Epocha>
            <Přezdívka>Vectron</Přezdívka>
            <Edice>PIKO EXPERT</Edice>
            <DCC_konektor>Ano NEM 658 Plux22</DCC_konektor>
            <Délka>218mm</Délka>
            <Poloměr>358mm</Poloměr>
            <Stát>Česko, Slovensko</Stát>
            <Výrobce>PIKO</Výrobce>
            <Čís.produktu>59591</Čís.produktu>
            <Cena>5990Kč</Cena>
            <Skladem>
                <SklademJe>Ano</SklademJe>
                <SklademKs>5Ks</SklademKs>
            </Skladem>
        </Model>
    </SHOPITEM>
    <SHOPITEM>
        <Model>
            <Název>H0 - el. lokomotiva Vectron ZSSK "SPOLOČNÁ CESTA K ÚSPECHU"</Název>
            <Druh>Elektrická Lokomotiva</Druh>
            <Měřítko>H0</Měřítko>
            <Žel.správa>ZSSK Slovensko</Žel.správa>
            <Epocha>VI</Epocha>
            <Edice>PIKO EXPERT</Edice>
            <Přezdívka>Vectron</Přezdívka>
            <DCC_konektor>Ano NEM 658 Plux22</DCC_konektor>
            <Délka>218mm</Délka>
            <Poloměr>358mm</Poloměr>
            <Stát>Slovensko</Stát>
            <Výrobce>PIKO</Výrobce>
            <Čís.produktu>59197</Čís.produktu>
            <Skladem>
                    <SklademJe>Předobjednávka</SklademJe>
                    <Expedice>08.11.2019</Expedice>
            </Skladem>
            <Cena>6790Kč</Cena>
        </Model>
    </SHOPITEM>
    <SHOPITEM>
        <Model>
            <Název>H0 - vůz Business-internet café RegioJet</Název>
            <Druh>Vagón</Druh>
            <Měřítko>H0</Měřítko>
            <Žel.správa>RegioJet CZ/SK</Žel.správa>
            <Epocha>VI</Epocha>
            <Edice>A.C.M.E.</Edice>
            <Přezdívka>Business-internet café</Přezdívka>
            <DCC_konektor>Ne</DCC_konektor>
            <Délka>303mm</Délka>
            <Stát>Česko</Stát>
            <Výrobce>A.C.M.E.</Výrobce>
            <Čís.produktu>52647</Čís.produktu>
            <Cena>1990Kč</Cena>
            <Skladem>
                <SklademJe>Ano</SklademJe>
                <SklademKs>2ks</SklademKs>
            </Skladem>
        </Model>
    </SHOPITEM>
</SHOP>